,Date,Author,Vertical,Headline,Description
227,"Apr 3, 2019, 04:56 IST","TNN / Apr 3, 2019, 04:56 IST",JAIPUR NEWS,Dhanani frontrunner for Amreli ticket?,"Gandhinagar: One day ahead of the final day for filing nominations for the general election on Thursday (April 4), the Congress’s central election committee (CEC) has finalised four more candidates for Lok Sabha seats in Gujarat.
In a surprise move, the party has reportedly decided to field leader of the opposition in the state assembly and Amreli MLA Paresh Dhanani for the Amreli Lok Sabha seat. The party has also reportedly zeroed in on two more sitting MLAs for Lok Sabha tickets.
The party has reportedly told all these candidates to have their papers ready for a last-minute nomination, in order to avoid factional rifts due to disappointed ticket hopefuls. However, no official list was declared by the Congress till late on Tuesday night. However, mediapersons were told about the developments informally.
The Congress has reportedly decided to field Gandhinagar North MLA C J Chavda against BJP president Amit Shah on the Gandhinagar Lok Sabha seat. Chavda is a former GAS cadre officer and has long experience as an MLA. He is a popular orator in the Congress.
While many local Congress leaders in Amreli district have resigned and joined the BJP citing their unhappiness with Dhanani’s leadership style, the Congress decided to field him due to his popularity among the masses. Dhanani has in the past defeated BJP stalwarts such as current Union minister Parshotam Rupala, former Gujarat agriculture minister Dilip Sanghani and Bavku Unghad. The current MLA from Lathi, former MP Virji Thumar, had also demanded the Amreli ticket. Sources said the Congress president suggested Dhanani’s name for Amreli considering his “winnability”.
From the Surendranagar Lok Sabha seat, the Congress is said to have decided to give the ticket to Limbdi MLA and former MP from the seat Soma Ganda Patel (Koli). Somabhai was called and told to file his nomination. Somabhai will be up against BJP first-timer Dr Mahendra Munjapara. Both come from the Koli community.
On the Jamnagar seat, against BJP MP Poonam Madam, the Congress will field Mulu Kandoriya, who is also from the Ahir community like Madam. Kandoriya has a good following in rural areas of the constituency.
Of the 18 candidates the Congress has nominated so far, seven are sitting MLAs.
Suspense continues over Congress candidates for four assembly bypolls
With all attention of Lok Sabha candidates, the Congress is yet to announce candidates for four assembly byelections, for the Manavadar, Unjha, Jamnagar Rural and Dhangadhara seats."
228,"Updated: Apr 3, 2019, 09:56 IST","TNN / Updated: Apr 3, 2019, 09:56 IST",KOCHI NEWS,Play ‘Gataar’ depicts problems faced by manual scavengers,"Nagpur: The 25th show of state level award winning one-act play ‘Gataar’, that shed light on the problems faced by millions of people engaged in manual scavenging and sewer cleaning, was staged at Scientific Society Hall, Laxmi Nagar, on Tuesday.
Written and directed by Virendra Ganvir, the show was staged by Bahujan Rangbhoomi.
Through the characters of Ravi (Shreyas Atkar), Amma (Asmita Patil), Baba (Ajay Wasnik), Gautam (Juhil Ukey), Shelly (Sanchi Telang) and Yadav (Risheel Dhoble), the play draws attention to the challenges faced by sewer cleaners like inadequate safety gear, susceptibility to severe sickness, chronic diseases and vulnerability to toxic gases.
Apart from the working conditions of sanitary workers, the play underlines the atrocities and disparity in social, educational and financial aspects encountered by them.
Talking to TOI, Virendra Ganvir, who is also founder of Bahujan Rangbhoomi, said, “The world is inching towards globalization. At the grass roots level, the sewer cleaners belong to one such section of people who deserve to be treated equally and this is what the play is trying to convey to the audience.”
Head of the departments of Marathi and Dr Babasaheb Ambedkar Thought of Nagpur University Shailendra Lende, author Shantirakshit Gawande, president of Navrang Creation Sunil Atkar, playwright Archana Khobragade, research scholar at Jawaharlal Nehru University Surendra Wankhede and littérateur Yashwant Manohar were the guests.
The technical support was given by Supriya Rajguru and Kishore Battase (lighting directors), Ritik Amalkar (set decorator), Ashish Durge (background music), Amit Ganvir (make-up artist), Karuna Naik (costume designer) and Surendra Wankhede (creative head).
Pratik Khobragade, Ajinkya Sute, Rishikesh Kapse, Neha Moon, Priyanka Tayde, Shubham Lute, Anshul Niwal, Pranav Orke, Jaswant Singh, Amar Nivesh, Arya Lede, Jagriti Khadatkar and Akshay Gedam looked after stage work."
229,"Apr 3, 2019, 04:58 IST","TNN / Apr 3, 2019, 04:58 IST",JAIPUR NEWS,"Educate society on autism to tackle issue, says doctor","Nagpur: Creating awareness and acceptance of autism in society is crucial as one per cent population of the world today is born autistic and one lakh children are added to the figure every year, said Dr Yashwant Patil, international president of Commonwealth Association for Health and Disability (Comahad) on Tuesday.
Talking to TOI on the sidelines of a programme organized by Comahad, Prayas School for Children with Special Needs and South Central Zone Cultural Centre on World Autism Awareness Day, Patil said, “I believe we have come a long way in creating awareness, but there is still a lot more to do.
There is a big chunk of society which still needs to be educated, from social workers to teachers to even paediatricians. People need to know that autism is not mental retardness, it’s a behavioural disorder that affects social skills,” he said.
Patil spoke about how early detection can help manage autism to a great extent. “Autistic children show early signs from the age of 6-9 months. If paediatricians are able to detect the signs within 30 months, there are interdisciplinary therapies through which autism can be managed,” said Patil.
Earlier, ‘Walk for autism’ rally was taken out from Sarvoday Ashram, Amravati Road. Over 120 students, parents and a few doctors participated in the rally with the aim of spreading awareness on the issues circling autism.
Later in the evening, specially abled students of Prayas School performed various acts and put up a fashion show in a cultural evening held at SCZCC. Director of SCZCC Deepak Khirwadkar was the chief guest while senior paediatrician and executive director of Comahad Dr Uday Bodhankar and school president Kiran Dive were present.
Speaking about the aim behind the international day, Dr Bodhankar said, “We are only asking for inclusiveness from society. Schools today can accommodate autistic children and teachers and staff can give a little extra guidance. Only awareness on such issues can make the society more accepting.”"
230,"Apr 3, 2019, 04:59 IST","TNN / Apr 3, 2019, 04:59 IST",BHOPAL NEWS,Hema accused of model code violation,"Chaumuha (Mathura): Bollywood star and sitting BJP MP Hema Malini, who is seeking re-election from Mathura, was accused of model code of conduct violation when she held a poll rally in the premises of a government school without permission. Mathura DM told TOI that he had asked an SDM to probe into allegations.
Hema, who was touring her constituency on Tuesday, arrived in Ajhai Khurd village at around 11:30 am and addressed the meeting in the school premises where crowds had gathered in advance. People of the village say that for the entertainment of the crowd, organizers had roped in dance performers, whose moves were vulgar.
Talking to reporters, principal of the school, Sarla Devi Sharma, said that the public meeting was organised without permission from the authorities. “When we came to school in the morning, a tent had been pitched there and public gathered. It was like occupying the school forcefully,” Sharma said, adding that when she raised the issue, she was told that there would not be any trouble to the school and students.
Sharma said that she had to close her school after the mid-day meals as there was no point of teaching students while such loud music was being played nearby. She said the organisers had told her that the meeting would finish in two hours. She also claimed that she had to intervene to stop the “obscene” dance performances. “With young children (6-14 years) studying in the school, the dance performance was absolutely undesirable”.
BJP city president, Chetan Swaroop Parashar said this area doesn’t come in his jurisdiction and he would need to check on it. Efforts to contact Hema Malini proved futile.
When contacted, Mathura DM Sarvagya Ram Mishra said that if the election rally was organised in the government school then it was certainly a violation of the model code of conduct and action would be taken against the person concerned. He said he had asked the SDM to inquire into the matter as he is not aware of it."
231,"Created: Apr 5, 2019, 00:00 IST",Sandra Marina Fernandes,KOCHI NEWS,6 cases for violating MCC,"Trichy: The city police registered six cases against unknown people for erecting flags for Congress candidate S Thirunavukkarasar’s campaign in the city on Monday.
The Woraiyur police registered two cases for putting up flag poles of Congress, DMK and their alliance parties on Woraiyur main road and Kura street on Monday.
The Thillai Nagar police also filed two FIRs against unknown people under TNOPPD Act for failing to get permission to install flag poles on Pattabiraman street, General Bazaar, Alwar Thoppu and Thillai Nagar. The Cantonment police also filed a case for erecting flag poles on the wall of a tea stall in Othakadai in Trichy.
The government hospital police booked unknown people for putting up the flag poles near Arul hospital in Vannarapettai in the city.
The case was booked under Tamil Nadu open places (prevention of disfigurement) (TNOPPD) Act for not obtaining prior permission from the election department as per the model code of conduct and causing nuisance to the general public. The names of the accused were not mentioned in the case."
232,"Created: Apr 5, 2019, 00:00 IST",Dhwani Desai,BHOPAL NEWS,Man booked for impregnating 13-year-old girl,"Tirupur: A 26-year-old man from Odisha was booked on charges of raping a 13-year-old girl from Bihar and impregnating the minor, who stays with her family in the city. The victim is six months pregnant.
According to police, the girl had come to the city seven months ago to live with her father, elder sister and brother-in-law, who had migrated to the city three years ago.
“The victim’s mother had died years ago and the girl was staying in a relative’s house in Bihar before moving to the city. A school dropout, she often stayed in the house with her elder sister, who had given birth to a baby recently, while her brother-in-law and father would go to work in knitwear units,” a police officer said.
The girl befriended Ajit Karshal, of Odisha, who was staying in her neighbourhood, and it seems the two were in a relationship, the officer said.
Recently, the girl complained of stomach pain and she was taken to Tirupur government hospital, where doctors found she was six months pregnant. Her father subsequently lodged a complaint with Tirupur south all-woman police, who booked Ajit under the Prevention of Children from Sexual Offences (POCSO) Act.
Ajit, who was staying in his relative’s house, is on the run, the officer said."
233,"Updated: Apr 5, 2019, 11:54 IST",Zinia Sen,KOZHIKODE NEWS,"Bansal pips Navjot, Tewari, eyes 5th term as Cong MP from city","Chandigarh: A 14-member central election committee of the Congress led by party president Rahul Gandhi on Tuesday cleared the name of former Union minister and four-time MP Pawan Kumar Bansal as the party candidate from Chandigarh for the Lok Sabha elections.
The committee had to choose out of Bansal, Dr Navjot Kaur Sidhu, the wife of Punjab minister Navjot Sidhu and senior Congress leader Manish Tewari. In the 2014 Lok Sabha elections, Tewari’s name was doing the rounds, but the party ultimately went with Bansal. However, BJP’s Kirron Kher had defeated him then.
The central leadership of the Congress conducted two surveys in the city to decide the candidate and the report of both studies was sent to its election committee.
Besides Rahul, his mother Sonia Gandhi and former Prime Minister Dr Manmohan Singh was on the election committee. Three former members of the Chandigarh election committee of the Congress, including A K Antony and Ahmed Patel, also attended the meeting. Chandigarh Congress president Pardeep Chhabra too participated in the meeting.
Three-cornered contest in BJP
In BJP, there is a three-cornered contest for the party ticket from the Chandigarh Lok Sabha seat. Sitting MP Kirron Kher, Chandigarh BJP president Sanjay Tandon and former MP Satya Pal Jain, are in fray for the ticket.
Dhawan from AAP
The AAP has already named former Union minister Harmohan Dhawan as its official candidate for the Lok Sabha elections. Dhawan had switched sides from the BJP. In the last elections, Dhawan’s name was under consideration for the BJP ticket, but in the end party banked on Kirron Kher. Later, Dhawan had extended his support to Kher.
Major achievements of Bansal
Fifteen trains started from Chandigarh during his tenure as railways minister and all pilgrimage places of Sikhs were connected with city.
IT Park was inaugurated by former Prime Minister Manmohan Singh
Scheme launched to construct 25,728 small flats at eight locations to make Chandigarh slum-free. As many as 13,000 flats constructed and possession of 8,000 handed over to the beneficiaries by former Prime Minister Dr Manmohan Singh"
234,"Created: Apr 5, 2019, 00:00 IST",V Lakshmi,NAGPUR NEWS,"Lok Sabha elections 2019: Congress battle ready, to fight on strength of its foot soldiers","NAGPUR: Though the office of District Congress Committee is located at Dewadiya Bhavan in Mahal, the campaign of Congress candidate Nana Patole is practically being run from Kachipura office of a Congress sympathizer Prashant Pawar.
Volunteers and party workers mill around the place sporting caps and scarves bearing the colours and symbol of the party. A group of workers who belong to NCP, a Congress alliance partner, are also chipping in. Patole had contested last election from Bhandara-Gondia constituency on a BJP ticket but later resigned and quit the party.
Patole’s day is planned to begin with a padyatra that starts around 8am. “More than 2,000 people voluntarily joined the march in North Nagpur today,” said Vikas Thakre, president of District Congress Committee. “Over the last three years, I have built the organization at the local level. To plan the campaign. Eighteen block presidents and 38 booth level presidents and heads of various committees meet at our office everyday,” Thakre adds. “The entire local Congress machinery is behind our candidate,” he adds.
Since Patole is also the chairman of All India Kisan Congress, a few members of the Kisan cell have also parked themselves in the city. “He is representing farmers and has stood up for their rights and so he is known all across the country,” says Priya Grewal, who has come from Delhi.
Door-to-door contact programmes, street corner meetings and rallies are organized for Patole every day. Women volunteers who are not party workers are also present in the office expressing their willingness to campaign for the leader. “Patole has a clean image and people are connecting with him on their own. He has risen from the grassroots level and is fighting to get justice. This is a war between a commoner and an industrialist or dhan shakti versus jan shakti,” says Thakre. “Both Gadkari and Patole entered politics at the same time. Patole is still a simple grassroots level leader, but Gadkari’s growth as a businessman has been phenomenal,” says Surendra Solanki, a party worker who has come from Delhi.
The election here is being fought through foot soldiers and personal contacts. The campaign managers still do not know how to fight the excessive trolls targeting their party. “We can’t match the viciousness of these trolls and so prefer not to reply to them. But the mood of the nation has changed and this is going to be a tough fight for BJP,” says Shyam Pande, a local Congress worker. “We too have set up our war room to handle social media, but BJP has lot of money,” says Thakre. “The people will fight this election for us. There are a lot of undercurrents and the poor and the business community, which were with Modi in the last election, are now returning to the Congress,” Thakre adds."
235,"Created: Apr 5, 2019, 00:00 IST",M Suganth,KOCHI NEWS,Department insider may be behind killing: Neha Shoree’s husband,"MOHALI: Varun Monga, the husband of drug licensing officer Neha Shoree, has ruled out revenge as the motive for the murder of his wife, suspecting the involvement of some ‘insiders’ in her department (food and drug administration).
“There was no way Balwinder waited for 10 years, suddenly got a licence made, bought a weapon, and killed Neha within a fortnight,” said Varun, alleging Balwinder was hired by someone and some insider was associated with the drug mafia. “The killer bought a pistol in urgency. So, there should be some reason for him that he was so desperate to kill her. If he was in a hurry, how could he wait for 10 years. He killed her in a crowded office with a licensed gun. It shows he did not want to hide his identity.”

Varun demanded a CBI probe into the killing, asking the agency to investigate the involvement of all those related to the case, including senior government officials at her department. He said Neha had told him that some people in the office were desperate to get her transferred out and wanted to grab her position.
“I want an honest probe in the case. They are people who have a lot of power in the system. The sequence of events show that some powerful people are involved in the incident. The racket could be drug mafia, it could be the department. You cannot overrule anything without being investigated. There are various facts which have to be verified,” he said.
On the demand for CBI inquiry, he said, “If there is possibility that some powerful elements can affect the investigation, why cannot we get the case investigated from the best agency? We want expeditious and honest probe. It should not be manipulated. I cannot get my wife back. I can only imagine her suffering. At least, I can hope that we have a good probe.”"
236,"Created: Apr 5, 2019, 00:00 IST",Madhu Daithota,KOZHIKODE NEWS,"Just one department opts for Panjab University’s Rs 50 lakh ‘earn-learn’ scheme, gets Rs 1 lakh","CHANDIGARH: Panjab University’s “Earn while you learn” scheme launched last year for students with much fanfare had only one taker — department of Hindi. The university allocated Rs 50 lakh for the scheme for the 2018-19 fiscal year, out of which less than Rs 1 lakh was given to the department and the remaining is lying unutilised.
“It takes some time for a scheme to take off. The departments will gradually pick up and apply. The grants, however, sanctioned will now be carried forward to the 2019-20 fiscal year,” said PU finance development officer Vikram Nayyar.

Research scholars of Hindi department have been working part-time in their department library and managing the entire work on their own. They work on rotation so that their studies don’t suffer. “Our students have worked very hard and we finally got the due. We had applied for grants under the scheme and had been following it up rigorously. I am thankful that the vice-chancellor has successfully implemented the scheme,” said Dr Gurmeet Singh, chairperson, Hindi department.
Students paid Rs 100 for every hour
Students of the department received their first cheque for the work done under the scheme since October.Panjab University syndicate in May 2018 had approved the policy. Under the scheme, students are paid Rs 100 per hour and each student will be allowed to work for a maximum of 40 hours in a month.A committee was constituted by former PU vicechancellor Arun Kumar Grover, who had identified part-time jobs, including those of library assistants, teaching assistants in labs, part-time data entry operator/computer operator for IQAC work. The VC had come up with the concept at a time when students were unhappy with the fee hike."
237,"Created: Apr 5, 2019, 00:00 IST",Divya Kaushik,TNN,Inaugural haj flight to take off from Kozhikode on July 4,"Malappuram: This year’s haj pilgrimage under the state haj committee will begin on July 4 when the inaugural haj flight will depart to Madina from the Calicut International Airport.
Recently, a delegation of the state haj committee had met civil aviation officials demanding the inaugural flight from Kozhikode. As haj committee of India (HCI)allotted pilgrimage under the first phase, pilgrims from Kozhikode and Kochi would directly travel to Madina, unlike the previous years. The pilgrimage from Kochi also will begin in the first week of July, but the date of the journey is yet to be confirmed, informed the state haj committee.
The HCI had allotted a total of 11,472 seats for the state, and the total number of haj applicants from the state this year was 43,115. Of these, 1,199 applicants are under reserved category for those above 70 years of age. A total of 2,011 women applicants without Mehram have been directly selected, and 8,262 persons have been selected through draw of lots held in January.
Remaining applicants would be considered for 25,000 additional seats which have been allotted for the country this year. The haj committee has directed those who were included in waiting list to produce their passports at its office between April 8 and 20.
Haj committee chairman C Muhammed Faizi said that the direct journey to Madina would benefit hundreds of non-resident Keralites. He said that the haj applicants could complete vaccination process even after holy month of Ramzan.
Faizi said that HCI chief executive officer Makhsood Ahamed Khan will visit the state in the coming days to hold discussion with representatives of airline companies Air India and Saudi Airlines. “He will also hold discussion with the Airports Authority of India officials at the Calicut airport,” he added."
238,"Updated: Apr 16, 2019, 12:07 IST",Reema Gowalla,TNN,Koz corp tops annual plan fund utilization in the state,"Kozhikode: The city corporation has topped the annual plan fund utilization of local self-government bodies among the six corporations in the state for the 2018-19 financial year. The corporation has utilized 81.32% of the total plan fund while the Kochi corporation stands second with 75.43% of fund utilization.
The remarkable thing is that the civic body has achieved the rare feat of above 80% plan fund utilization after a gap of over a decade. It had achieved 100% plan fund utilization tag in the 2006-07 financial year.
According to corporation officials, of the Rs 118.62-crore budget allocation, the civic body has spent Rs 96.46 crore during 2018-19. Kochi corporation has spent Rs 85.67 crore from the allotted Rs 113.57 crore.
In the 2017-18 financial year, the Kozhikode corporation was in the sixth position by spending only 76.92% percent of the plan fund. It had spent Rs 86.85 crore from the Rs 112.91 crore budgetary allocation.
Corporation secretary Binu Francis said the actual plan fund utilization touched 100% as the 81.32% is the figure up to mid-March. “The total plan fund utilization will touch 100% once the treasury encashes the bills submitted in the March 15-31 period,” said the secretary.
“The credit for this goes to the joint effort taken by the corporation council, various standing committee heads and the officials entrusted with the implementation process. Periodical reviews by the heads of various standing committees with the project implementing officials resulted in achieving this rare feat,” said Francis.
Meanwhile, corporation planning officer N V Sujith said that bills worth Rs 30.29 crore which constitutes 21.80% submitted after March 15 needs to be encashed to get the actual figure. At present, the bills are pending at the treasury owing to paucity of funds,” he said."
