,Date,Author,Vertical,Headline,Description
67,"Created: Apr 3, 2019, 00:00 IST",Sunayana Suresh,Events,'Kalank' trailer will be out tomorrow; Alia Bhatt shares the glimpse,"Abhishek Varman's 'Kalank' has been the talk of the town since the announcement. The posters and the teaser have raised excitement among the audience to watch the film. The songs also received a lot of appreciation and love.

Read Also
'Kalank' action director Sham Kaushal reveals Varun Dhawan has pushed his limits for the film

Now, the makers are all set to release the trailer of the film on 3rd April. And Alia Bhatt took to her social media handles to share the glimpse of the same. She captioned the video, ""Kalank trailer tomorrow! #Kalank@duttsanjay #AdityaRoyKapur @Varun_dvn @sonakshisinha @MadhuriDixit @abhivarman"".


Starring Sanjay Dutt, Madhuri Dixit Nene, Varun Dhawan, Sonakshi Sinha and Aditya Roy Kapur, the film is all set to hit the theatres on April 17."
68,"Created: Apr 3, 2019, 00:00 IST",V Lakshmi,Hindi,"I haven’t lost a guru, I have lost my soul! says Prachee Shah Paandya in Lucknow","Actress and kathak dancer Prachee Shah Paandya known for her roles in serials like 'Kyunki Saas Bhi Kabhi Bahu Thi', 'Iss Pyaar Ko Kya Naam Doon..Ek Baar Phir' and more was in Lucknow recently for an event. The actress, who was part of the film 'Mulk' which was shot extensively in Lucknow, says that Lucknow somehow brings out her artistic personality. ""I shot for 'Mulk' which was for around 21 days and starting from having nawabi cuisines on set to chikan shopping, everything was just amazing, I really enjoyed myself. I feel that Lucknow actually brings out the artist in me. Of course, my journey started with Lucknow and Jaipur where I used to come and do stage shows. I feel that somewhere, Lucknow se mera pichhle janm ka naata hai. It has a great vibe and I love wearing chikan suits. I think, given a choice for 365 days I can wear chikan suits and saris. I am not a jeans and a western attire person, so I am happy wearing a chikan kurta and sharara which I think suits me the best. I love the whole feel of the place."" The kathak danseuse and actress who recently lost her guru Ganesh Hiralal ji, of the seventh generation of the Hiralal family of the Jaipur gharana, feels that she has not just lost her guru but someone who taught her to live through dance. Talking about it and getting emotional at the same time, Prachee says, ""The emotions are coming out in bouts because this morning when I woke up I had no one to talk to. He was 82 and for two years he had congestion in his chest. Who would have thought that one day I would wake up and not find him around me. He was someone who was more of a father figure rather than a guru.""

Prachee with her guru late Ganesh Hiralalji (BCCL/ Aditya Yadav)

She adds, ""I haven’t lost a guru, I have lost my soul! I have learnt kathak for about 25 years and maine hamesha se one-on-one seekha hai. I have not attended any class so that bond was even more special. He was 82-years-old and one would not believe that he had performed on vocal padhanth with me till last year in all major festivals whether in India or abroad. So the thought that he is not around is still difficult for me to take in. My father and my husband were there during the funeral ceremony and they kept on sending me pictures, and I was crying continuously. I still can’t imagine that I have lost him because he is somebody who moulded me as a human being right from the way I project myself, the way I dress up and the way I talk. Unka hamesha se kehna tha ki ‘kaam bolna chahiye’, he never believed in outer appearances."" Adding, she says, ""The moment you are on stage whether it is for three hours or three minutes, it’s your entry that says it all. These were his words. The only strength I get while I am on stage is the fact that he is there with me on stage who can easily handle my flaws. And despite being a guru, he never overpowered me on stage. He said that ‘this is your stage, you make the laye, you make the rhythm, you conduct the show and I am there to guide you’. I mean which guru does that? I feel that I am thoroughly blessed to have him in his life. It’s been 25 years and all major festivals in the country or abroad, I have travelled everywhere with him and not once did he say ki ‘main thak gaya hoon ya mujhse nahi hoga’. He was the simplest man who was happy having daal, chawal, roti, sabzi and ice cream was his favourite dessert.""

Prachee Shah Paandya (BCCL/ Aditya Yadav)

""Now I really don’t know how will I be on stage, the fact that he will not be present to teach me and guide me is frightening. All these years he has seen me enter into the phase of a wife to a mother and been there when I was expecting my first child. The entire spiritual aspect in me is totally because of him because he was so spiritual,"" adds the actress who has also done films like Judwaa 2 and Student of The Year. The actress shares that the transition from television to film has been more difficult for her. Talking about her role in Mulk, Prachee says the film gave her a strong recognition in the film fraternity. ""I have been a part of television for more than 20 years so to kind of give you a breakthrough in films with a performance oriented role, I think Mulk has kind of started it for me. And now I can hope to do better films. I have done a complete commercial film like 'Judwaa 2' with David Dhawan ji, which sometimes amazes me ki I have done that film. I fall in such an age group where I neither look 45-50 years old nor 25-30. That is a reason I get to play the roles of mother and I believe playing a mother has a more wide range to it and a longer run career wise. So I am happy I got to do a film like Mulk which challenged me as an actor,"" says Prachee, who says she would love to experiment more with such roles.

— Prachi Arya"
69,"Created: Apr 3, 2019, 00:00 IST",Sandra Marina Fernandes,Bollywood,"Joe Russo: Robert Downey Jr acts like a diva, but he is actually the hardest working actor you will ever work with","It cannot get bigger than this. “I am not going to answer any questions on the plot of Endgame. It took me three years to protect it from Tom Holland and Mark Ruffalo, so I am not going to suddenly give it away,” jokes American filmmaker Joe Russo, of the Russo brothers, co-director of the year’s, perhaps, the decade’s most awaited superhero film — Avengers: Endgame, in a candid chat. This is his fourth Marvel film and the twenty-second film in the entirety of the Marvel Cinematic Universe (MCU). In Mumbai, to kick-start the film’s promotions, Joe spoke to Bombay Times on Indian influences in the Marvel series, his comic-book fixation, Stan Lee, Robert Downey Jr (RDJ) being nothing like Tony Stark, need for diversity, longevity of superhero films and more.
This is your first visit to India. Take us through your experience so far.
I have never been here before, so I came with an open mind. I am ecstatic. One of the real values of getting to work on these films is that you get to travel across the globe and interact with people from different cultures. I am a big fan of telling my children that their job in life is to collect as many fascinating experiences as they can. Part of that is travelling, cultural experiences, understanding the world and becoming a

global citizen. It’s really meaningful for me to get my family here.


Are you familiar with Indian cinema?
I have seen a few Indian films like Dabangg. I think Indian audiences will love the fact that Robot/Enthiran (S Shankar’s 2010 bilingual starring Rajinikanth) was almost a big influence on Avengers: Age of Ultron, 2015 (directed by Joss Whedon). There is a sequence in Robot, where all the robots come together to form a giant snake. In the Avengers movie, there was a bunch of Ultrons, who come together to form a giant Ultron. The scene was eventually cut for time, but that was a direct influence from Robot.

You have made four Marvel films in the past six years. What do you think is integral to the future of superhero films?
The more diverse they get, the more interesting they become. Everyone has a right to see themselves on screen. Audiences become more passionate, when storytellers get more inclusive. The next phase of Marvel movies will get more diverse. Look at the success of Black Panther and Captain Marvel. The new crop of stories will have more pure global influence.


During an interview Tom Hanks told us that because of the rich technology and CGI, superhero films are living up to the promise of comic books. But eventually, the tide will turn. The stories that always remain with you are the ones showing human condition.
These (superhero films) are human stories! They are highly relatable characters. Listen, I think that if it’s not your cup of tea, you tend to shutout. For a whole global generation of film goers, these movies have become very important. They are a part of their growing up years and pop culture. The best of these movies tell compelling stories about humans, who happen to have powers. The powers are secondary to the experiences of characters as people and the choices that they make. I think the best of these movies have incredible thematics in them. I don’t necessarily think you can call superhero films a fad, when it has this kind of global reach. I think you just have to respect the fact the audience finds a lot in these films to inspire and connect them.

Speaking of #Whateverittakes (the punchline of Endgame), what does it take for you and Anthony (the other Russo brother co-directing the film) to work with so many superstars on one film?
It takes a lot (smiles!). It’s been a great experience for us. We have been very fortunate that this cast is incredible. Look, Oscar winners show up just to do one day’s work for your film, so you are spoilt as a filmmaker with the love of your cast.

You hear things like Robert Downey Jr wanting multiple vanity vans. He even jokes about it. He seems like a diva. Is he like that for real?
He jokes about it (laughs!), but you know why he does that? I think it is to play along and create a persona. He acts like a diva, but he is actually the hardest working actor you will ever work with. He is exceedingly professional. There is a reason why he is one of the biggest movie stars in the world. The energy and effort he puts into his work every second and the way he approaches his character and believes what it is, the way he shows up on set everyday, the level of intensity he brings to his work ethic — it’s commendable. Even when he promotes his films... that requires a lot of effort. He has a certain effervescence about him that’s universally translated and it comes at a cost. It requires him to project himself a certain way.

Tony Stark feels like RDJ’s alter ego, Chris Hemsworth exudes Thor’s confidence in his physical strength... it’s amazing how these characters seem like they are based on the actors that play them.
It’s interchangeable, isn’t it? You want the actors to have an emotional connect with the characters they play. When you really get to know Robert, you discover that he is nothing like Tony Stark. He has a public persona that he slips into, which is like Tony but when you have an intimate conversation with him, you realise he is very different. He is warm, genuine and generous human being. Chris Evans relates to one of the important people from his childhood. He based Captain America’s performance on this man he knew, so that’s very personal. They all find a certain sense of themselves in these characters after playing them for so long.

Is this Chris Evans’ last film as Captain America? He had hinted about it.
Chris Evans said this is his last film? I don’t know what he has been drinking (smiles). Impossible to say, anything can happen. This is the Marvel Universe. I won’t give away the plot, except that Infinity War was told from the point of view of Thanos and this one is not.

It was heartbreaking to see Loki being killed in Infinity War.
A lot of people are upset about that but all good things come to an end.

Speaking of fiercely guarding the plot, is it true that Tom Holland doesn’t get the script because he can’t keep secrets?
Yes, he doesn’t (smiles). He just gets his lines and that’s it. He is not even told who he is acting opposite of. We use vague terms to describe to him what’s happening. He has a difficult time keeping his mouth shut (laughs).



The legendary Stan Lee is no longer with us. It won’t be the same without him, isn’t it?
I wouldn’t be where I am today if it wasn’t for Stan Lee. I grew up on his comic books since I was 10, he is my idol. I believe that his final cameo is in this film. To get an opportunity to not only work on the material that he created, but to be able to work with him was a dream come true.

What are the pros and cons of co-directing with your brother Anthony, being part of a joint venture?
The pros are the fact that we have been able to make four Marvel movies in the last six years without dropping dead. There are no cons. Of course there are conflicts. We are always arguing and that makes this process successful. We challenge every idea that comes to the table and the best idea wins. It’s about maintaining the right balance between pushing against each other and backing off. Out of that comes a chemistry that creates these movies.

The superheroes abstain from sex. There was an interesting article on this that recently went viral.
No sex in Avengers movies? There was a bedroom scene in Infinity War, which implied that. But I think it is about the demographics. These movies need to translate with the children as well as they do gravitate towards these movies. The whole family should be able to enjoy these films without having to put hands on their children’s eyes. At the core, the characters are human and their psychology has been the focus more than their sexuality I guess.

What’s next for you in the MCU?

Eleven years of storytelling, nine franchises and 22 movies culminate into this film. Now, I want to take a little break. We have made four films in six years. You need to find the right stories to be able to reach the audience on this scale. It has been an enriching experience for us.


Endgame is the longest Marvel film till date?

It’s 3 hours and 2 minutes. It’s 11 years of narrative culminating into one movie. We are focusing on the original six avengers and closing the book on those characters so a lot of thought went into creating a powerful ending. We just couldn’t get the duration down. It’s a lot of storytelling with lot of characters. No one has ever done even remotely anything like this. A lot of characters in Infinity War are staggering. It requires a lot of disciple and focus to create moments that validate the existence of those characters in that story. Endgame is wrapping up all of this so we knew it will never be under three hours.


While DC has had an inconsistent run at the box office. Marvel keeps churning blockbusters time and again. What is the secret?

Marvel does this amazing job of picking people who care about these films and find immense joy in making them. Be it James Gunn, Ryan Coogler or my brother and myself. I have been collecting comic books since I was 10 years old. Being comic book geeks means you understand the methodology behind the characters. You understand the archetype and values they represent. The audience values the subtleties you bring to the table."
70,"Created: Apr 3, 2019, 00:00 IST",V Lakshmi,Bollywood,Is all well between Donal Bisht and her director beau Prateek Shah?,"Over the past few months, all eyes have been on actress Donal Bisht and her beau, Prateek Shah, who was the director of her last TV show, 'Ek Deewaana Tha'. Love blossomed between the two after the show wrapped up last year. While everything was seemingly fine between them, it was recently reported that Prateek has moved on and is now dating Reyhna Pandit, who plays the antagonist on 'Manmohini', which he was directing till some time ago. Many feel that his relationship with Donal went kaput because of Reyhna’s proximity to the director.

A source close to Prateek and Donal shared, “They have taken time off from their relationship. It was a mutual decision taken a couple of months ago. Whether they get back together or not, only time will tell.”


Denying any truth to the rumours of him dating Reyhna, Prateek told us, “Whatever is between Donal and me, should remain between us. Whether we are together or not is entirely our call. What I can say for sure is that there is no third party involved in this situation. No one has ever created a rift between us, and to set the record straight, I am not dating Reyhna.”

He added, “I get along with Reyhna and other team members of 'Manmohini', as we are all of the same age group. We had a lot of fun and enjoyed our time together during the shoot. I am friends with a lot of girls, and that doesn’t mean I am dating all of them. In fact, even Reyhna was aghast to hear these stories. The truth is, I have already moved on to the next project and hardly visit the set of 'Manmohini' these days. Just because I mingle well with people, it’s easy to link me with girls my age. A good friendship shouldn’t always be looked upon as an affair.”


On her part, Donal said, “I don’t want to talk about my personal life. I would like my work to be discussed, as I am completely focussed on it.” Despite repeated attempts, we couldn’t reach Reyhna for comment."
71,"Created: Apr 3, 2019, 00:00 IST",Sandra Marina Fernandes,Movies,"Bombay HC refuses to interfere with Modi biopic, EC says it doesn’t violate model code of conduct","On Monday, the Bombay High Court disposed of a PIL seeking a stay on the Narendra Modi biopic, refusing to interfere with the release of the film and directing the Election Commission to take a decision. The EC counsel told the court that the release of the film is not a violation of the model code of conduct. Whether the film is released on April 5 or not is the decision of the Central Board of Film Certification (CBFC) and not the EC.
EC has nothing to say about the film’s release: EC counsel

A PIL was filed in the Bombay High Court against the film’s release, alleging that it violated the model code of conduct. The petitioner, Satish Sugriv Gaikwad, had sought a stay order on the release of the biopic. Following this, the Bombay HC issued a notice to the EC, asking for a response on the PIL. It had also asked the producers to submit their response. A division bench of Bombay high court comprising Chief Justice Naresh Patil and Justice NM Jamdar was hearing the PIL. Disposing the PIL, the HC bench said on Monday, “The Election Commission has already taken note of it and shall deal with it.”

Advocate Birendra Saraf, who presented the filmmakers and Vivek Oberoi in the film, told the court that a reply has already been filed to the EC.

Pradeep Rajagopal, who represented the Election Commission in the court, says, “The Bombay HC has dismissed the plea. Now the petitioner can appeal to the Election Commission if he is not satisfied. But the release of the film during this period is not a violation of the model code of conduct, we have told this to the court. Whether the film will be released on April 5 or not, is the decision of the CBFC and not of the Election Commission. The Election Commission has nothing to say about the release of the film.”

CBFC has not yet certified the film, only the trailer: CBFC counsel

Advait Sethna, counsel for the CBFC, told the court that the CBFC has not certified the film yet, and they have issued certification only for the film’s trailer on March 20. The scheduled examination for film’s certification is today. Rajagopal told us, “Whether the film can release or not will be decided by the CBFC on the basis of the Cinematograph Act, and not because of model code of conduct violation, because it is not a violation.”

On Monday, after the HC dismissed the plea, the producer of the film, Sandip Ssingh, said in a statement, “We are very happy that finally the justice has been given to the film. We believe in the system and the law. We are hoping to release the film on time now.”

Earlier on Monday, the Delhi High Court refused to entertain a PIL asking for a stay on film’s release after being informed that the Bombay High Court, as well as the Election Commission, was already seized of the issue. On Friday, the Allahabad High Court, had also adjourned the hearing of a similar PIL, citing that the EC had already issued notices to the producers."
